<?xml version="1.0" encoding="UTF-8"?>
<!DOCTYPE students SYSTEM "students.dtd">
<students>
    <student id="SV001">
        <name>Nguyễn Văn A</name>
        <dob>2001-05-10</dob>
        <major>Công nghệ thông tin</major>
    </student>
    <student id="SV002">
        <name>Trần Thị B</name>
        <dob>2002-08-21</dob>
        <major>Quản trị kinh doanh</major>
    </student>
</students>
